{
  "id": "pinned-futures.syntax.box-pin-construction",
  "kind": "syntax",
  "title": "Constructing a pinned boxed future",
  "concepts": [
    "pinned-futures"
  ],
  "prompt": "How do you construct a pinned boxed future from an async block in Rust?",
  "answer": "Pass the async block directly into Box pin. This allocates the future on the heap and wraps it in a Pin container that prevents it from moving in memory.",
  "schema_version": 1
}
